{
  "sub_domain_id": "cash-management",
  "display_name": "Cash Management",
  "parent_domain": "asset-servicing",
  "resource_scoped": true,
  "entity_types": [
    {
      "key": "relationship_id",
      "extract_as": "relationship_reference",
      "kind": "resolvable",
      "display": "servicing relationship",
      "id_pattern": "REL-\\w+",
      "resolve_type": "relationship",
      "required": false
    },
    {
      "key": "fund_id",
      "extract_as": "fund_reference",
      "kind": "resolvable",
      "display": "fund or portfolio",
      "id_pattern": "FND-\\w+",
      "resolve_type": "fund",
      "required": false
    },
    {
      "key": "account_id",
      "extract_as": "account_id",
      "kind": "literal",
      "display": "cash account",
      "id_pattern": "ACCT-\\w+",
      "required": false
    },
    {
      "key": "currency",
      "extract_as": "currency",
      "kind": "literal",
      "display": "currency",
      "id_pattern": "[A-Z]{3}",
      "required": false
    }
  ],
  "required_context": [
    "relationship_id"
  ],
  "agents": [
    "meridian.servicing.cash_management"
  ],
  "messages": {
    "capability_unavailable": "I can't reach a service authorized to answer that part of your request. If you have access to a related capability, ask for it directly and I'll help."
  }
}
