{
  "sub_domain_id": "corporate-actions",
  "display_name": "Corporate Actions",
  "parent_domain": "asset-servicing",
  "resource_scoped": false,
  "entity_types": [
    {
      "key": "fund_id",
      "extract_as": "fund_reference",
      "kind": "resolvable",
      "display": "fund or portfolio",
      "id_pattern": "FND-\\w+",
      "resolve_type": "fund",
      "required": false
    },
    {
      "key": "security_id",
      "extract_as": "security_id",
      "kind": "literal",
      "display": "security or ISIN",
      "id_pattern": "[A-Z]{2}[A-Z0-9]{10}|[A-Z]{2,5}",
      "required": false
    },
    {
      "key": "valuation_date",
      "extract_as": "valuation_date",
      "kind": "literal",
      "display": "valuation or NAV date",
      "id_pattern": "\\d{4}-\\d{2}-\\d{2}",
      "required": false,
      "default": "latest available"
    }
  ],
  "required_context": [],
  "agents": [
    "meridian.servicing.corporate_actions",
    "meridian.servicing.nav"
  ],
  "messages": {
    "capability_unavailable": "I can't reach a service authorized to answer that part of your request. If you have access to a related capability, ask for it directly and I'll help."
  }
}
