{
  "sub_domain_id": "claims-servicing",
  "display_name": "Claims Servicing",
  "parent_domain": "insurance",
  "resource_scoped": true,

  "entity_types": [
    {
      "key": "policy_id",
      "extract_as": "policy_reference",
      "kind": "resolvable",
      "display": "insurance policy",
      "id_pattern": "POL-\\d+",
      "resolve_type": "policy",
      "required": true
    },
    {
      "key": "claim_id",
      "extract_as": "claim_reference",
      "kind": "resolvable",
      "display": "claim",
      "id_pattern": "CLM-\\d+",
      "resolve_type": "claim",
      "required": false
    },
    {
      "key": "period",
      "extract_as": "period",
      "kind": "literal",
      "display": "reporting period",
      "id_pattern": "(Q[1-4]\\s+\\d{4}|YTD|QTD|MTD)",
      "required": false,
      "default": "YTD"
    }
  ],

  "required_context": ["policy_id"],

  "denial_messages": {
    "not-covered": "That policy is not in your book of business.",
    "coverage-transferred": "Servicing for that policy has been transferred to another underwriter.",
    "policy-closed": "That policy is no longer active.",
    "default": "Access denied for this policy."
  },

  "messages": {
    "no_coverage": "You have no policies in your book of business.",
    "reference_not_found": "I could not find a policy matching \"{reference}\". Please provide the policy ID or a more specific name.",
    "needs_more_detail": "I wasn't sure which services to consult. Please mention the policy and what you need.",
    "specify_entity": "Please specify the policy name or policy ID.",
    "missing_entity_question": "Which policy are you asking about? Please provide the policy ID or insured name to continue.",
    "followup_clarification": "Could you clarify what you'd like to know about {entity}? For example: policy details, premium, coverage limit, or claim status."
  },

  "clarification_schema": {
    "policy_id": {
      "question": "Which policy are you asking about?",
      "options_source": "discover",
      "priority": 1
    },
    "claim_id": {
      "question": "Which claim are you asking about? Please provide the claim ID (e.g. CLM-5501).",
      "options_source": "none",
      "priority": 2
    }
  },

  "agents": [
    "acme.insurance.policy_details",
    "acme.insurance.claim_status"
  ]
}
